{
  "$schema": "../../schemas/component-profile.schema.json",
  "schema_version": "1.1",
  "component_id": "sht31",
  "display_name": "SHT31 Temperature & Humidity",
  "type": "temperature_humidity",
  "category": "environment",
  "protocol": "i2c",
  "variants": {
    "primary": "sht31",
    "easily_confused_with": [
      {
        "component_id": "sht30",
        "difference": "SHT30 is the lower-accuracy grade (+/- 3% RH vs +/- 2% on SHT31); SHT35 is the higher-accuracy grade (+/- 1.5%). Same pinout and I2C protocol."
      }
    ],
    "knockoffs_known": false,
    "verification_method": "Check the Sensirion laser marking; the grade letter distinguishes SHT30/31/35. All share I2C address 0x44."
  },
  "i2c": {
    "default_addresses": [
      "0x44",
      "0x45"
    ],
    "address_strap_pin": "ADDR (LOW=0x44, HIGH=0x45)",
    "max_speed_khz": 1000
  },
  "pin_requirements": {
    "count": 2,
    "type": "i2c",
    "must_use_default_i2c_pins": false,
    "adc_required": false,
    "input_only_ok": false,
    "strapping_pin_ok": false,
    "5v_tolerant_required": false,
    "interrupt_capable_required": false
  },
  "external_components": {
    "pullup_resistor": {
      "value_ohm": 4700,
      "required": true,
      "note": "External I2C pull-ups if the board does not provide them"
    },
    "decoupling_cap": {
      "value_uf": 0.1,
      "required": true
    }
  },
  "power": {
    "voltage_min": 2.15,
    "voltage_max": 5.5,
    "tolerates_5v": true,
    "level_shifter_required_on_5v_board": false,
    "current_ma_active": 1.5,
    "current_sleep_ua": 0.2
  },
  "limitations": {
    "min_read_interval_s": 0.5,
    "operating_temp_c": "-40 to +125",
    "humidity_range": "0-100%",
    "accuracy_temp_c": "+/- 0.3",
    "accuracy_humidity": "+/- 2%"
  },
  "calibration": {
    "required": false,
    "type": null
  },
  "esphome": {
    "platform": "sht3xd",
    "min_version": "2022.1.0"
  },
  "datasheet_url": "https://sensirion.com/products/catalog/SHT31-DIS-B/",
  "sourcing": {
    "lcsc": "C80862",
    "jlcpcb_library_type": "expand",
    "jlcpcb_checked": "2026-10-05",
    "jlcpcb_stock_status": "in_stock"
  }
}
